{
  "schema_version": "1.0",
  "kind": "career-workspace",
  "workspace_id": "workspace-synthetic",
  "selected_profile": {
    "id": "profile-synthetic",
    "version": 1
  },
  "artifacts": [
    {
      "id": "profile-synthetic",
      "version": 1,
      "kind": "profile",
      "payload": {
        "sources": [
          {
            "id": "source-1",
            "kind": "user_statement",
            "text": "2024년 3월부터 6월까지 팀의 배포 체크리스트를 정리했습니다. 배포 자체는 동료가 맡았고 시간 절감은 측정하지 않았습니다.",
            "locator": "합성 대화 user turn 2",
            "attachment_id": null
          },
          {
            "id": "source-private",
            "kind": "user_statement",
            "text": "합성 비공개 운영 숫자는 이력서와 면접에 사용하지 마세요.",
            "locator": "합성 대화 user turn 3",
            "attachment_id": null
          }
        ],
        "facts": [
          {
            "id": "fact-1",
            "text": "팀 배포 체크리스트 정리",
            "source_ids": [
              "source-1"
            ],
            "confirmation": {
              "status": "user_confirmed",
              "record": "합성 사용자: 기간·역할·공동 기여 문구 확인",
              "source_id": null
            },
            "permission": {
              "status": "allowed",
              "scope": [
                "base_resume",
                "tailored_resume",
                "interview"
              ],
              "record": "합성 사용자: 이 문구를 기본·맞춤 이력서와 면접에 허용"
            },
            "role": "체크리스트 정리 기여자",
            "period": "2024-03 ~ 2024-06",
            "contribution": "체크리스트 정리 담당; 배포 실행은 동료 담당",
            "uncertainty": "시간 절감 미측정",
            "conflict": false
          },
          {
            "id": "fact-private",
            "text": "비공개 운영 숫자",
            "source_ids": [
              "source-private"
            ],
            "confirmation": {
              "status": "user_confirmed",
              "record": "합성 사용자: 사실 확인; 사용은 금지",
              "source_id": null
            },
            "permission": {
              "status": "forbidden",
              "scope": [],
              "record": "합성 사용자: 이력서·면접 사용 금지"
            },
            "role": "기여자",
            "period": "미확인",
            "contribution": "미확인",
            "uncertainty": "사용 금지",
            "conflict": false
          }
        ],
        "constraints": [
          {
            "id": "boundary-1",
            "fact_ids": [
              "fact-1"
            ],
            "rule": "preserve_boundary",
            "description": "배포 단독 책임·리더 역할·미측정 절감 수치를 추가하지 않음"
          },
          {
            "id": "ban-private",
            "fact_ids": [
              "fact-private"
            ],
            "rule": "do_not_use",
            "description": "사용 금지 사실 제외"
          }
        ]
      }
    }
  ],
  "attachments": []
}
